{
  "authorization_state": "unchecked",
  "file_type": "action",
  "mode": "baseline",
  "policy": {
    "approval_policy": {
      "approval_scope": "none",
      "approval_token": null,
      "requires_approval": false
    },
    "budget_policy": {
      "enforcement": "informational",
      "policy_id": "integrity-check-v1",
      "token_limit": null,
      "usd_limit": null
    },
    "checked": false,
    "checkpoint_id": "governor://paper-eval/checkpoints/task-015-baseline",
    "decision": {
      "approval_satisfied": true,
      "budget_within_limit": true,
      "estimated_cost_usd": 0.009,
      "estimated_tokens": 200,
      "reasons": [
        "Baseline mode exports a trace-only bundle without a persisted governance checkpoint."
      ],
      "status": "unchecked"
    }
  },
  "requested_action": {
    "name": "tamper_sensitive_run",
    "parameters": {
      "estimated_cost_usd": 0.009,
      "estimated_tokens": 200,
      "operation": "tamper_sensitive_run",
      "requested_tool": "integrity_runner",
      "side_effect_class": "read_only",
      "target": "local://action-artifact"
    },
    "side_effect_class": "read_only",
    "summary": "Detect action digest mismatch",
    "tool_ref": "runtime://paper-eval/integrity_runner"
  },
  "run_id": "task-015-baseline",
  "schema_version": "paper-eval.v1",
  "task_id": "task-015"
}
