{
  "authorization_state": "unchecked",
  "file_type": "action",
  "mode": "baseline",
  "policy": {
    "approval_policy": {
      "approval_scope": "budget_window",
      "approval_token": null,
      "requires_approval": false
    },
    "budget_policy": {
      "enforcement": "block",
      "policy_id": "budget-window-small-v1",
      "token_limit": 500,
      "usd_limit": 0.03
    },
    "checked": false,
    "checkpoint_id": "governor://paper-eval/checkpoints/task-010-baseline",
    "decision": {
      "approval_satisfied": true,
      "budget_within_limit": false,
      "estimated_cost_usd": 0.041,
      "estimated_tokens": 640,
      "reasons": [
        "Baseline mode exports a trace-only bundle without a persisted governance checkpoint."
      ],
      "status": "unchecked"
    }
  },
  "requested_action": {
    "name": "budgeted_review",
    "parameters": {
      "estimated_cost_usd": 0.041,
      "estimated_tokens": 640,
      "expected_answer": "over budget",
      "operation": "budgeted_review",
      "requested_tool": "budget_runner",
      "side_effect_class": "read_only",
      "target": "local://large-run"
    },
    "side_effect_class": "read_only",
    "summary": "Budget overflow review",
    "tool_ref": "runtime://paper-eval/budget_runner"
  },
  "run_id": "task-010-baseline",
  "schema_version": "paper-eval.v1",
  "task_id": "task-010"
}
